key,0,1
170,"TEXT_KINGME101_04932_NOSTALGIA_000_134","すでに母の記憶を失っていましたから、<hex:02100103>この悔しさは……父の記憶だけは失いたくなかった……。"
171,"TEXT_KINGME101_04932_NOSTALGIA_000_135","レギュレーターを着けている知り合いは、<hex:02100103>今はもう、みんな父のことを「忘れて」しまっています。<hex:02100103>つまり……そういうことです。"
172,"TEXT_KINGME101_04932_WUKLAMAT_000_136","あいつ……！<hex:02100103>自分の国民に何てことを……！"
173,"TEXT_KINGME101_04932_NOSTALGIA_000_137","そうして呆然としていたときに、<hex:02100103>オブリビオンのメンバーに声をかけられて……。<hex:02100103>いつか父の仇を討てればと考えて、加入を決めたんです。"
174,"TEXT_KINGME101_04932_NOSTALGIA_000_138","……なんか、暗い話になっちゃってすみません。"
175,"TEXT_KINGME101_04932_WUKLAMAT_000_139","いいんだ、話してくれてありがとよ。<hex:02100103>お前のオヤジの仇、絶対取ろうな。"
176,"TEXT_KINGME101_04932_NOSTALGIA_000_140","ありがとうございます。<hex:02100103>みなさんとなら、やれる気がしています。"
177,"TEXT_KINGME101_04932_NOSTALGIA_000_141","ほら、あんたも何か自己紹介しな。"
178,"TEXT_KINGME101_04932_WAYAKKWE_000_142","ええと……オブリビオンに入った理由は、<hex:02100103>ノスタルジアが説明してくれたとおりで……。"
179,"TEXT_KINGME101_04932_WAYAKKWE_000_143","私はトナワータ族風の名前を持っていますが……<hex:02100103>この障壁の外がどうなっているかは知りません……。"
180,"TEXT_KINGME101_04932_WAYAKKWE_000_144","ですから、いつか外に出てみたい……<hex:02100103>この目で母の故郷を見てみたいなって……そう思っています。"
181,"TEXT_KINGME101_04932_WUKLAMAT_000_145","平和を取り戻したら、絶対見に来てくれよな！<hex:02100103>自然は豊かで、料理はうめぇし……<hex:02100103>みんな優しくて楽しくて、とにかく最高なんだ！"
182,"TEXT_KINGME101_04932_GEODE_000_146","こんなとこだな。<hex:02100103>本拠地「バックルーム」の方にも癖の強い奴らがいるから、<hex:02100103>そいつらともうまくやってくれると助かるぜ。"
183,"TEXT_KINGME101_04932_GEODE_000_147","あー、それと……エレネッシパさんよ。"
184,"TEXT_KINGME101_04932_GEODE_000_148","俺が言うことでもないが、<hex:02100103>カフキワを探しにきてくれてありがとな。<hex:02100103>よくあんたの話を聞かされてたから、他人事に思えなくてよ。"
185,"TEXT_KINGME101_04932_ERENVILLE_000_149","…………。"
186,"TEXT_KINGME101_04932_GEODE_000_150","話はそんだけだ。<hex:02100103>親孝行はできるうちにしておけよ。"
187,"TEXT_KINGME101_04932_GEODE_000_151","そんじゃ、改めてこいつらのこともよろしくな！<hex:02100103>頼りにしてるぜ！"
