key,0,1
#,,
offset,0,4
int32,str,str
0,"TEXT_KINGYX901_05374_SEQ_00","ベイサイド・ベヴィーのモブハント組合員は、期待のこもった眼差しで冒険者を見つめている。"
1,"TEXT_KINGYX901_05374_SEQ_01","モブハント組合員と話した。シャーローニ荒野のフーサタイ宿場町に行き、「<hex:02280CFF05>EObj<hex:F61EBE650103>」で見渡そう。"
2,"TEXT_KINGYX901_05374_SEQ_02","討伐の依頼主を見つけた。フーサタイ宿場町の「旅のアイルー」と話そう。"
3,"TEXT_KINGYX901_05374_SEQ_03","旅のアイルーを連れて、シャーローニ荒野のヤータナネ草地で、アルシュベルドの痕跡を探そう。<hex:02100103><hex:02100103>※同行状態が解除された場合、再度「旅のアイルー」に話しかけることで同行を再開できます。"
4,"TEXT_KINGYX901_05374_SEQ_04","獣の痕跡を見つけたが、アルシュベルドのものではなかった。旅のアイルーを連れて、ヤータナネ草地で、アルシュベルドの痕跡を探そう。"
5,"TEXT_KINGYX901_05374_SEQ_05","アルシュベルドの痕跡はまだ見つからない。旅のアイルーを連れて、ヤータナネ草地で、アルシュベルドの痕跡を探そう。"
6,"TEXT_KINGYX901_05374_SEQ_06","アルシュベルドの痕跡を見つけた。フーサタイ宿場町付近にいる「セクレト」に話しかけて騎乗し、アルシュベルドを追跡しよう。"
7,"TEXT_KINGYX901_05374_SEQ_07","アルシュベルドを発見した。パリヨーナン沃野にいる「旅のアイルー」と話そう。"
8,"TEXT_KINGYX901_05374_SEQ_08","旅のアイルーはキャンプ設営キットを調達していたようだ。隔ての荒地へ向かおう。"
9,"TEXT_KINGYX901_05374_SEQ_09","アルシュベルドを狩る前に、準備をしておいた方がよさそうだ。隔ての荒地にいる「旅のアイルー」と話そう。<hex:02100103>隔ての荒地へは、シャーローニ荒野のパリヨーナン沃野にいる旅のアイルーと話すことで移動できるようだ。"
10,"TEXT_KINGYX901_05374_SEQ_10","上手に焼けました。隔ての荒地にいる「旅のアイルー」と再度話そう。"
11,"TEXT_KINGYX901_05374_SEQ_11","狩りの準備は整った。「護竜アルシュベルド」の狩猟に挑み、旅のアイルーの依頼を達成しよう。<hex:02100103><hex:02100103>※コンテンツファインダーから攻略に参加できます。"
12,"TEXT_KINGYX901_05374_SEQ_12","アルシュベルドを狩猟した。隔ての荒地にいる「旅のアイルー」と話そう。"
13,"TEXT_KINGYX901_05374_SEQ_13","旅のアイルーと話した。トライヨラのベイサイド・ベヴィーにいる「モブハント組合員」と話そう。"
14,"TEXT_KINGYX901_05374_SEQ_14","モブハント組合員と話した。旅のアイルーは、広大な自然を冒険しながら、元の世界へ戻る方法を探すようだ。また、加工屋では、アルシュベルドの体から入手できる「<hex:02280BFF05>Item<hex:F2B7FC0103>」を取引してくれるという。<hex:02280BFF05>Item<hex:F2B7FC0103>を集め、特別な報酬を手に入れよう！"
15,"TEXT_KINGYX901_05374_SEQ_15",""
16,"TEXT_KINGYX901_05374_SEQ_16",""
17,"TEXT_KINGYX901_05374_SEQ_17",""
18,"TEXT_KINGYX901_05374_SEQ_18",""
19,"TEXT_KINGYX901_05374_SEQ_19",""
20,"TEXT_KINGYX901_05374_SEQ_20",""
21,"TEXT_KINGYX901_05374_SEQ_21",""
22,"TEXT_KINGYX901_05374_SEQ_22",""
23,"TEXT_KINGYX901_05374_SEQ_23",""
24,"TEXT_KINGYX901_05374_TODO_00","フーサタイ宿場町の<hex:02280CFF05>EObj<hex:F61EBE650103>で見渡す"
25,"TEXT_KINGYX901_05374_TODO_01","旅のアイルーと話して同行させる"
26,"TEXT_KINGYX901_05374_TODO_02","旅のアイルーを連れて<hex:02100103>アルシュベルドの痕跡を探す"
27,"TEXT_KINGYX901_05374_TODO_03","旅のアイルーを連れて<hex:02100103>アルシュベルドの痕跡を再度探す"
28,"TEXT_KINGYX901_05374_TODO_04","旅のアイルーを連れて<hex:02100103>アルシュベルドの痕跡をさらに探す"
29,"TEXT_KINGYX901_05374_TODO_05","セクレトと話す"
30,"TEXT_KINGYX901_05374_TODO_06","旅のアイルーと話す"
31,"TEXT_KINGYX901_05374_TODO_07","旅のアイルーと話す"
32,"TEXT_KINGYX901_05374_TODO_08","旅のアイルーと再度話す"
33,"TEXT_KINGYX901_05374_TODO_09","旅のアイルーとさらに話す"
34,"TEXT_KINGYX901_05374_TODO_10","「護竜アルシュベルド狩猟戦」を攻略"
35,"TEXT_KINGYX901_05374_TODO_11","「護竜アルシュベルド狩猟戦」を攻略"
36,"TEXT_KINGYX901_05374_TODO_12","トライヨラのモブハント組合員と話す"
37,"TEXT_KINGYX901_05374_TODO_13",""
38,"TEXT_KINGYX901_05374_TODO_14",""
39,"TEXT_KINGYX901_05374_TODO_15",""
40,"TEXT_KINGYX901_05374_TODO_16",""
41,"TEXT_KINGYX901_05374_TODO_17",""
42,"TEXT_KINGYX901_05374_TODO_18",""
43,"TEXT_KINGYX901_05374_TODO_19",""
44,"TEXT_KINGYX901_05374_TODO_20",""
45,"TEXT_KINGYX901_05374_TODO_21",""
46,"TEXT_KINGYX901_05374_TODO_22",""
47,"TEXT_KINGYX901_05374_TODO_23",""
48,"TEXT_KINGYX901_05374_HUNTER05374_000_001","ややっ、あなたは武の院も認める手練れ、<hex:02100103><hex:022C0DFF07><hex:022903EB0203><hex:FF02> <hex:0203>さんですね？<hex:02100103>よろしければ、少しお話を聞いていただきたく……！"
49,"TEXT_KINGYX901_05374_HUNTER05374_000_002","ややっ、これは<hex:022C0DFF07><hex:022903EB0203><hex:FF02> <hex:0203>さん！<hex:02100103>よろしければ、少しお話を聞いていただけないでしょうか？"
50,"TEXT_KINGYX901_05374_HUNTER05374_000_003","実はこのところ、シャーローニ荒野で、<hex:02100103>動物の不審死が相次いでいるんです。<hex:02100103>そこで我々が調査に乗り出そうとした矢先、こんなものが……。"
51,"TEXT_KINGYX901_05374_HUNTER05374_000_004","討伐依頼には違いないのでしょうが、独特な絵柄ですよね。<hex:02100103>依頼主はその、ヘイザ・アロ族にしては小柄だし……<hex:02100103>かといってララフェル族とも違う、見慣れぬ種族の方でして。"
52,"TEXT_KINGYX901_05374_Q0_100_000","何と言う？"
53,"TEXT_KINGYX901_05374_A0_100_001","確かにいつもの依頼書とは違う"
54,"TEXT_KINGYX901_05374_A0_100_002","狩りがいがありそうだ"
55,"TEXT_KINGYX901_05374_A0_100_003","この絵柄、似たものを前にも見たような……"
56,"TEXT_KINGYX901_05374_HUNTER05374_100_004","なんと、以前にも似たような討伐依頼を？<hex:02100103>それは心強い！"
57,"TEXT_KINGYX901_05374_HUNTER05374_000_005","動物の不審死については、付近で巨大生物の目撃情報もあり、<hex:02100103>話に聞くところ、この手配書の特徴にも合致しそうなのです。"
58,"TEXT_KINGYX901_05374_HUNTER05374_000_006","ぜひ、ヴァリガルマンダ討伐を成し遂げたあなたに、<hex:02100103>対応をお願いしたいのですが……。"
59,"TEXT_KINGYX901_05374_Q0_000_000","何と言う？"
60,"TEXT_KINGYX901_05374_A0_000_001","ひと狩りしたかったところだ！"
61,"TEXT_KINGYX901_05374_A0_000_002","危険な存在なら、討伐するしかない"
62,"TEXT_KINGYX901_05374_HUNTER05374_000_008","おお、それはありがたい！<hex:02100103>詳しい話は、依頼主に直接聞いてみてください。<hex:02100103>きっと、腕に自信のある猛者を探しているはず。"
63,"TEXT_KINGYX901_05374_HUNTER05374_000_009","ご理解いただけたようで幸いです。<hex:02100103>ぜひ依頼主に会って、詳しい話を聞いてみてください。<hex:02100103>きっと、腕に自信のある猛者を探しているはず。"
64,"TEXT_KINGYX901_05374_HUNTER05374_000_010","フーサタイ宿場町の酒場付近で見渡せば、<hex:02100103>きっとすぐに見つかると思いますよ！"
65,"TEXT_KINGYX901_05374_HUNTER05374_000_015","シャーローニ荒野に未知の魔獣が現れ、討伐依頼がありました。<hex:02100103>依頼主はこのあたりでは見慣れぬ種族だったので、<hex:02100103>フーサタイ宿場町の酒場の近くで見渡せば、見つかるかと。"
66,"TEXT_KINGYX901_05374_SYSTEM_000_020","このあたりでは見かけない鳥のような生き物だ。<hex:02100103>どことなく、チョコボに似ている気がする……。"
67,"TEXT_KINGYX901_05374_WANDERINGFELYNE_000_100","うん、ボクが討伐依頼を出した旅のアイルーだよ。<hex:02100103>もしかして、<hex:02081FE905FF0D>お姉さん<hex:FF0D>お兄さん<hex:03>はハンターなの？"
68,"TEXT_KINGYX901_05374_Q2_000_000","何と言う？"
69,"TEXT_KINGYX901_05374_A2_000_001","ただの冒険者だ"
70,"TEXT_KINGYX901_05374_A2_000_002","そういうときもある"
71,"TEXT_KINGYX901_05374_A2_000_003","ニャって言わないのか……"
72,"TEXT_KINGYX901_05374_WANDERINGFELYNE_000_102","じゃあ、いろんなモンスターに詳しそうだね。<hex:02100103>君に討伐をお願いしてもいいかな？"
73,"TEXT_KINGYX901_05374_WANDERINGFELYNE_000_103","冒険者兼ハンターなんだね！<hex:02100103>それじゃ、ボクと一緒に狩りに行かない？"
74,"TEXT_KINGYX901_05374_WANDERINGFELYNE_000_104","もしかして、ボクのほかにもアイルーに会ったことがあるの？<hex:02100103>君は経験豊富な冒険者なんだね！"
75,"TEXT_KINGYX901_05374_WANDERINGFELYNE_000_105","ボクは腕に自信がある人を探してるんだけど、<hex:02100103>君にモンスターの討伐をお願いしてもいいかな？"
76,"TEXT_KINGYX901_05374_WANDERINGFELYNE_000_106","ありがとう！<hex:02100103>こっちの世界にはハンターが集まる「集会所」がないから、<hex:02100103>君から声をかけてくれて助かったよ。"
77,"TEXT_KINGYX901_05374_WANDERINGFELYNE_100_106","そっか、ボクがこの世界にやってきた経緯も話さないとね。<hex:02100103>それには今回の依頼の討伐対象が関係してるんだ。"
78,"TEXT_KINGYX901_05374_WANDERINGFELYNE_000_107","その名は「<hex:024A1DFF07E8ADB7E7AB9CFF13E382ACE383BCE38387E382A3E382A2E383B303> アルシュベルド」。"
79,"TEXT_KINGYX901_05374_WANDERINGFELYNE_100_107","禁足地っていう場所に棲むモンスターで、<hex:02100103>ボクと仲間たちは、その生態を調査してたんだよ。"
80,"TEXT_KINGYX901_05374_WANDERINGFELYNE_000_108","でもあるとき突然、空から謎の遺物が現れた。<hex:02100103>それに反応したように新たなアルシュベルドが繭から孵って、<hex:02100103>両者は縄張り争いを始めたんだ。"
81,"TEXT_KINGYX901_05374_WANDERINGFELYNE_000_109","その果てに、遺物が光る輪っかを出した。<hex:02100103>次の瞬間、アルシュベルドは跡形もなく消えてて。"
82,"TEXT_KINGYX901_05374_WANDERINGFELYNE_100_109","ボクも目の前が真っ白になっちゃって…。<hex:02100103>気づいたら、このトラル大陸にいたというわけ。"
83,"TEXT_KINGYX901_05374_WANDERINGFELYNE_000_110","あのとき遺物は「さーくるぷろぐらむを更新」とか言ってたから、<hex:02100103>きっとその影響なんだと思う。"
84,"TEXT_KINGYX901_05374_WANDERINGFELYNE_000_111","というわけで、ボクらは元の場所に戻る方法を探してたんだけど、<hex:02100103>アルシュベルドが近くで暴れてることがわかってね。<hex:02100103>生態系が壊される前に狩らなきゃって、ハンターを募ってたんだ。"
85,"TEXT_KINGYX901_05374_WANDERINGFELYNE_100_111","それじゃ、さっそく追跡を始めよう。"
86,"TEXT_KINGYX901_05374_WANDERINGFELYNE_200_111","モンスターのあとを追うには、<hex:02100103>そいつだけが残す特徴的な痕跡を辿るのが一番。"
87,"TEXT_KINGYX901_05374_WANDERINGFELYNE_000_112","アルシュベルドの特徴は、白い体毛と、前脚の「鎖刃」だね。<hex:02100103>鎖のようにしならせた伸縮自在の刃で、<hex:02100103>相手を斬りつけたり、締め付けたりするんだよ。"
88,"TEXT_KINGYX901_05374_WANDERINGFELYNE_000_113","おかげで、アイツが通った地面には、<hex:02100103>必ず鎖を引きずったような跡が目印に残ってるんだ。"
89,"TEXT_KINGYX901_05374_WANDERINGFELYNE_000_114","目撃情報があったのは、<hex:02100103>ここから北のヤータナネ草地ってところみたい。<hex:02100103>痕跡が残ってないか、探しにいこう！"
90,"TEXT_KINGYX901_05374_WANDERINGFELYNE_100_114","ボクはこの辺のモンスターのことには詳しくないから、<hex:02100103>君のうしろからついていくね！"
91,"TEXT_KINGYX901_05374_SYSTEM_000_150","何をする？"
92,"TEXT_KINGYX901_05374_SYSTEM_000_151","話す"
93,"TEXT_KINGYX901_05374_SYSTEM_000_152","同行状態を解除する"
94,"TEXT_KINGYX901_05374_SYSTEM_000_153","キャンセル"
95,"TEXT_KINGYX901_05374_WANDERINGFELYNE_000_115","モンスターの痕跡は、落とし物があればわかりやすいんだけど、<hex:02100103>アルシュベルドの場合、ちょっとそれは難しいんだ。<hex:02100103>残念だけど、地道に体毛や鎖刃の跡を探そう。"
96,"TEXT_KINGYX901_05374_SYSTEM_000_160","同行状態を解除します。本当によろしいですか？"
97,"TEXT_KINGYX901_05374_WANDERINGFELYNE_000_161","ほかに用事があるの？<hex:02100103>じゃあ、さっきのところで待ってるね。"
98,"TEXT_KINGYX901_05374_WANDERINGFELYNE_000_162","おかえりなさい！<hex:02100103>それじゃ、アルシュベルドの痕跡を探しにいこう！"
99,"TEXT_KINGYX901_05374_SYSTEM_000_170","<hex:024804F2022403>「フーサタイ宿場町」について話す<hex:0248020103>"
100,"TEXT_KINGYX901_05374_WANDERINGFELYNE_000_171","この町には、変わった武器を持った人が何人もいるでしょ？<hex:02100103>ハンターさんかと思ったら、「じけいたい」だって言われて。<hex:02100103>イケナイ人を捕まえるお仕事の人なんだね。"
101,"TEXT_KINGYX901_05374_WANDERINGFELYNE_000_172","ボクたちもモンスターを討伐せずに捕獲することがあるよ。<hex:02100103>落とし穴やシビレ罠にかけて、動けなくなったときを狙って、<hex:02100103>麻酔玉をもりもり投げまくるんだ！"
102,"TEXT_KINGYX901_05374_WANDERINGFELYNE_000_173","罠の設置は大得意だから、<hex:02100103>もしおたずねものを見つけたらボクに任せて！"
103,"TEXT_KINGYX901_05374_SYSTEM_000_180","<hex:024804F2022403>「シャーローニ荒野」について話す<hex:0248020103>"
104,"TEXT_KINGYX901_05374_WANDERINGFELYNE_000_181","この荒野は、砂塵が激しい地域のようだけど、<hex:02100103>ボクがいた禁足地も、環境の変化が激しいところでね。"
105,"TEXT_KINGYX901_05374_WANDERINGFELYNE_000_182","荒廃期には、飢えた肉食モンスターが群れて争い、<hex:02100103>異常気象になると、生態系の頂点を司るモンスターが出現。<hex:02100103>とーっても危険な状況になったりする。"
106,"TEXT_KINGYX901_05374_WANDERINGFELYNE_000_183","でも、それらを経た先には豊穣期がやって来て、<hex:02100103>動植物がたくさん増えるんだ。<hex:02100103>どの時期も違った発見があって、探検のしがいがあるよ！"
107,"TEXT_KINGYX901_05374_WANDERINGFELYNE_000_190","あっ、この生き物はセクレトっていうんだ。<hex:02100103>ボクと一緒にここまでやってきたんだけど…"
108,"TEXT_KINGYX901_05374_WANDERINGFELYNE_000_191","長旅で疲れてるから、今はここで休ませてるんだよ。<hex:02100103>またあとで紹介するね。"
109,"TEXT_KINGYX901_05374_SYSTEM_000_195","このクエストを進行させるには、<hex:02100103>旅のアイルーが同行している状態で、<hex:02100103>さらに、プレイヤーの近くにいる必要があります。"
110,"TEXT_KINGYX901_05374_SYSTEM_000_196","同行者がまだ到着していない。<hex:02100103>近くまで迎えにいって、ともに痕跡を調べよう。"
111,"TEXT_KINGYX901_05374_SYSTEM_000_200","乾いた草の塊が、固まって落ちている。<hex:02100103>周辺に生息するタンブルクラブのものと似ているようだ。"
112,"TEXT_KINGYX901_05374_WANDERINGFELYNE_100_200","植物に擬態するモンスターの痕跡かぁ。<hex:02100103>アルシュベルドとは関係ないみたい。"
113,"TEXT_KINGYX901_05374_WANDERINGFELYNE_200_200","禁足地にも、「ハナショウジョウ」っていう、<hex:02100103>花に擬態する生き物がいるんだ。"
114,"TEXT_KINGYX901_05374_WANDERINGFELYNE_300_200","そっくりな帽子を被って、<hex:02100103>ハナショウジョウに擬態するハンターもいたりして、<hex:02100103>どれが本物かわからなくなったっけ。"
115,"TEXT_KINGYX901_05374_WANDERINGFELYNE_400_200","このあたりにはアルシュベルドの痕跡はないみたいだから、<hex:02100103>ほかの場所を探してみよう。"
116,"TEXT_KINGYX901_05374_SYSTEM_000_201","（★未使用／削除予定★）"
117,"TEXT_KINGYX901_05374_SYSTEM_000_202","（★未使用／削除予定★）"
118,"TEXT_KINGYX901_05374_SYSTEM_000_203","黄色い毛束に、粘着性のある液体が絡みついている。<hex:02100103>周辺の環境生物の種類から察するに、<hex:02100103>サンビアードを襲った、グラスランドウォームの捕食痕だろうか。"
119,"TEXT_KINGYX901_05374_WANDERINGFELYNE_100_203","アルシュベルドの体毛は白だから、これも違うね。<hex:02100103>護竜はみんな全体的に白いのが特徴なんだ。"
120,"TEXT_KINGYX901_05374_WANDERINGFELYNE_200_203","「空の王者」と呼ばれる真紅の火竜リオレウスでさえ、<hex:02100103>護竜だと白い個体になるんだって。"
121,"TEXT_KINGYX901_05374_WANDERINGFELYNE_300_203","（★未使用／削除予定★）"
122,"TEXT_KINGYX901_05374_WANDERINGFELYNE_400_203","よし、気を取り直して、別の痕跡を探しにいこう！"
123,"TEXT_KINGYX901_05374_SYSTEM_000_204","（★未使用／削除予定★）"
124,"TEXT_KINGYX901_05374_SYSTEM_000_205","（★未使用／削除予定★）"
125,"TEXT_KINGYX901_05374_SYSTEM_000_206","なにかを引きずったような跡があり、<hex:02100103>周囲には、白い破片のようなものが散乱している。"
126,"TEXT_KINGYX901_05374_SYSTEM_000_207","（★未使用／削除予定★）"
127,"TEXT_KINGYX901_05374_WANDERINGFELYNE_000_208","（★未使用／削除予定★）"
128,"TEXT_KINGYX901_05374_WANDERINGFELYNE_000_209","これは、鎖刃の破片！<hex:02100103>間違いなく護竜アルシュベルドのものだよ。<hex:02100103>よく見つけたね！"
129,"TEXT_KINGYX901_05374_WANDERINGFELYNE_000_210","こんな近くにまで来てたなんて。<hex:02100103>集落の方に向かう前に引き返したみたいだけど、<hex:02100103>何か起こる前に、居所を突き止めないと。"
130,"TEXT_KINGYX901_05374_WANDERINGFELYNE_000_211","よし、ここまではっきりとした痕跡が見つかったのなら、<hex:02100103>アルシュベルドが近くにいるのは間違いない。"
131,"TEXT_KINGYX901_05374_WANDERINGFELYNE_100_211","しっかり追いかけるために、町で休ませてる心強い仲間も呼ぼう！<hex:02100103>この痕跡を採集しておいてくれる？"
132,"TEXT_KINGYX901_05374_WANDERINGFELYNE_000_212","この生き物はセクレト。<hex:02100103>狩りに必要な品をポーチに入れて騎乗できるうえに、<hex:02100103>モンスターの匂いを覚えて、そのあとを追うことができるんだ。"
133,"TEXT_KINGYX901_05374_WANDERINGFELYNE_100_212","さあここで、さっきも紹介したセクレトの出番だよ！<hex:02100103>狩りに必要な品をポーチに入れて騎乗できるうえに、<hex:02100103>モンスターの匂いを覚えて、そのあとを追うことができるんだ。"
134,"TEXT_KINGYX901_05374_WANDERINGFELYNE_000_213","さっきの痕跡をセクレトに嗅がせてみて。"
135,"TEXT_KINGYX901_05374_WANDERINGFELYNE_000_214","匂いを覚えたみたい。<hex:02100103>これで、アルシュベルドのところまで連れていってくれるよ！"
136,"TEXT_KINGYX901_05374_WANDERINGFELYNE_000_216","さっそくセクレトに乗って、対象の位置を突き止めてほしい。<hex:02100103>ボクは狩りの準備をしてから追いかけるね。"
137,"TEXT_KINGYX901_05374_WANDERINGFELYNE_000_217","そうだ、旅の商人さんとの物々交換で手に入れた、<hex:02100103>リンクパールっていうのを、君にも渡しておこう。<hex:02100103>別行動をしてても、これで連絡が取れるはず。"
138,"TEXT_KINGYX901_05374_WANDERINGFELYNE_000_220","それじゃ、アルシュベルドの追跡をお願い。<hex:02100103>セクレトが、きっとうまく連れていってくれるよ！"
139,"TEXT_KINGYX901_05374_WANDERINGFELYNE_000_215","（★未使用／削除予定★）"
140,"TEXT_KINGYX901_05374_WANDERINGFELYNE_000_218","（★未使用／削除予定★）"
141,"TEXT_KINGYX901_05374_WANDERINGFELYNE_000_219","（★未使用／削除予定★）"
142,"TEXT_KINGYX901_05374_SYSTEM_000_300","セクレトは、軽快に嘶いている。<hex:02100103>背中に乗れと言っているようだ。"
143,"TEXT_KINGYX901_05374_SYSTEM_000_301","セクレトに乗って、アルシュベルドを追跡しますか？"
144,"TEXT_KINGYX901_05374_WANDERINGFELYNE_000_302","(-旅のアイルー-)ボクの声、聞こえてるかな？<hex:02100103>離れてても話せるなんて、リンクパールってすごいね！"
145,"TEXT_KINGYX901_05374_WANDERINGFELYNE_000_303","(-旅のアイルー-)護竜はね、ずっと繭の中で眠ってたんだけど、<hex:02100103>強い存在を感知すると目覚める性質があるんだ。"
146,"TEXT_KINGYX901_05374_WANDERINGFELYNE_000_305","(-旅のアイルー-)集落の近くまで来てたのに引き返したのは、<hex:02100103>もっと手強い相手を見つけたからかも。"
147,"TEXT_KINGYX901_05374_WANDERINGFELYNE_000_304","(-旅のアイルー-)西の方にあるビリビリ球の中は、雷が激しい土地なんでしょ？<hex:02100103>アルシュベルドが向かってたらやっかいだなあ。"
148,"TEXT_KINGYX901_05374_WANDERINGFELYNE_000_306","(-旅のアイルー-)モンスターの死体があったって！？<hex:02100103>それなら、捕食の痕跡がないか、ちょっと調べてみて！"
149,"TEXT_KINGYX901_05374_SYSTEM_000_350","魔物が絶命しているが、かじられた跡は見受けられない。<hex:02100103>捕食するために襲われたわけではないようだ。"
150,"TEXT_KINGYX901_05374_WANDERINGFELYNE_000_351","(-旅のアイルー-)やっぱりね。<hex:02100103>護竜は普通のモンスターとは違う、特別な種だから、<hex:02100103>他者を捕食しないんだ。"
151,"TEXT_KINGYX901_05374_WANDERINGFELYNE_000_352","(-旅のアイルー-)ただ、この一帯に漂うエネルギーに執着して、<hex:02100103>邪魔なモンスターを排除してるんじゃないかな。"
152,"TEXT_KINGYX901_05374_Q1_000_000","何と言う？"
153,"TEXT_KINGYX901_05374_A1_000_001","トラルヴィドラールのような変異種か"
154,"TEXT_KINGYX901_05374_A1_000_002","食事をせずに生きられるのか？"
155,"TEXT_KINGYX901_05374_WANDERINGFELYNE_000_353","(-旅のアイルー-)こっちには、そういう特殊なモンスターがいるんだ？<hex:02100103>やっぱり世界は広いなぁ。"
156,"TEXT_KINGYX901_05374_WANDERINGFELYNE_000_354","(-旅のアイルー-)護竜とは少し違うけど、<hex:02100103>長く生きたことですごい力を獲得するだなんて、<hex:02100103>まさに「歴戦の個体」って感じだね。"
157,"TEXT_KINGYX901_05374_WANDERINGFELYNE_000_355","(-旅のアイルー-)それには、ちょっと複雑な理由があって。<hex:02100103>彼ら護竜の身体には、捕食に関する器官がないんだ。"
158,"TEXT_KINGYX901_05374_WANDERINGFELYNE_000_356","(-旅のアイルー-)だから、他者を襲う理由も、<hex:02100103>捕食するためってわけじゃなくて…"
159,"TEXT_KINGYX901_05374_WANDERINGFELYNE_000_357","(-旅のアイルー-)アルシュベルドが縄張り争いをしてるの？<hex:02100103>きっと気が立って、強い相手に見境なく襲い掛かってるんだ。"
160,"TEXT_KINGYX901_05374_WANDERINGFELYNE_000_358","(-旅のアイルー-)このままじゃ、周りの生態系がめちゃくちゃになってしまうよ。<hex:02100103>どうにかして止めないと。"
161,"TEXT_KINGYX901_05374_WANDERINGFELYNE_100_358","(-旅のアイルー-)そうだ、セクレトのポーチの中から、<hex:02100103>ちょっと臭いのキツい玉を取り出してみて！"
162,"TEXT_KINGYX901_05374_WANDERINGFELYNE_150_358","(-旅のアイルー-)それは「こやし玉」といって、強烈な臭いで、<hex:02100103>怒ったモンスターでさえ逃げていく、狩りのひつじゅひんなんだ。"
