key,0,1
163,"TEXT_KINGYX901_05374_WANDERINGFELYNE_200_358","(-旅のアイルー-)護竜には効き目がないと思うけど、<hex:02100103>縄張り争いの相手なら追い払えるはずだよ！<hex:02100103>おもいっきり投げつけてみて！"
164,"TEXT_KINGYX901_05374_WANDERINGFELYNE_000_359","(-旅のアイルー-)アルシュベルドも逃げていったの？<hex:02100103>もしかすると、君を手強い相手だと思って、<hex:02100103>ねぐらに戻って傷を癒やそうとしているのかも。"
165,"TEXT_KINGYX901_05374_WANDERINGFELYNE_000_360","(-旅のアイルー-)すぐに追いかけたいところだけど、<hex:02100103>ボクも合流するから、そこで待ってて！"
166,"TEXT_KINGYX901_05374_SYSTEM_000_380","セクレトは勇ましく佇んでいる。<hex:02100103>まだまだアルシュベルドを追跡するつもりのようだ。"
167,"TEXT_KINGYX901_05374_WANDERINGFELYNE_000_400","このあたりで縄張り争いが続いてたら、<hex:02100103>近くの集落まで巻き込まれてたかも。<hex:02100103>こやし玉で追い払えてよかったよ。"
168,"TEXT_KINGYX901_05374_WANDERINGFELYNE_000_401","アルシュベルドのねぐらはこの先にあるみたいだね。<hex:02100103>傷を癒やしに戻ったはずだから、しばらくは動かないと思う。"
169,"TEXT_KINGYX901_05374_WANDERINGFELYNE_000_402","君がアルシュベルドを追いかけてる間に、<hex:02100103>ボクは「キャンプ設営キット」を調達してきたんだ。"
170,"TEXT_KINGYX901_05374_WANDERINGFELYNE_100_402","ギリギリまで近づいてからキャンプを設営して、<hex:02100103>そこで狩りに備えよう！"
171,"TEXT_KINGYX901_05374_SYSTEM_200_402","狩りに備えるため、<hex:02100103>簡易キャンプを設営しに移動しますか？"
172,"TEXT_KINGYX901_05374_WANDERINGFELYNE_000_405","この先に、簡易キャンプを設営したよ。<hex:02100103>そこで準備をしてから、アルシュベルドのねぐらに向かおう！"
173,"TEXT_KINGYX901_05374_SYSTEM_000_410","「隔ての荒地」に移動しますか？"
174,"TEXT_KINGYX901_05374_SYSTEM_000_415","セクレトは周囲の匂いを吟味している。<hex:02100103>いつでも出発できそうだ。"
175,"TEXT_KINGYX901_05374_WANDERINGFELYNE_000_500","簡易キャンプを設営完了！<hex:02100103>この辺にモンスターはいないようだから、<hex:02100103>壊される心配もないよ。"
176,"TEXT_KINGYX901_05374_WANDERINGFELYNE_000_501","さあ、さっそく狩りに！<hex:02100103>といきたいところだけど、その前にまずは食事にしよう。<hex:02100103>腹が減っては…って言うからね。"
177,"TEXT_KINGYX901_05374_WANDERINGFELYNE_000_502","もちろん、材料や道具は用意してあるよ。<hex:02100103>「肉焼きセット」を使って腹ごしらえだ！"
178,"TEXT_KINGYX901_05374_SYSTEM_000_550","もう一度、肉を焼いて食べますか？"
179,"TEXT_KINGYX901_05374_WANDERINGFELYNE_000_600","上手に焼けたね！<hex:02100103>たくさん食べたから、体力もスタミナも満タンだ！"
180,"TEXT_KINGYX901_05374_WANDERINGFELYNE_000_601","そうそう、これも持っておいて。<hex:02100103>グビッと飲み干す「回復薬グレート」だよ！"
181,"TEXT_KINGYX901_05374_WANDERINGFELYNE_100_601","これはハンターズギルドが支給してる回復薬に、<hex:02100103>ボクが採集したハチミツを混ぜた特製品。<hex:02100103>ちょうど砂原が豊穣期で、いつもよりたくさん採れたんだ。"
182,"TEXT_KINGYX901_05374_WANDERINGFELYNE_200_601","よし、準備はこれで万全だね。<hex:02100103>この世界のハンターである君に、あらためて依頼させてほしい。"
183,"TEXT_KINGYX901_05374_WANDERINGFELYNE_000_602","これ以上、荒野の生態系を破壊させないためにも、<hex:02100103>どうかアルシュベルドを狩って！<hex:02100103>お願いだよ！"
184,"TEXT_KINGYX901_05374_SYSTEM_000_603","護竜アルシュベルド狩猟戦では、<hex:02100103>コンテンツアクション「回復薬グレート」が使用できます。"
185,"TEXT_KINGYX901_05374_WANDERINGFELYNE_000_650","アルシュベルドはとっても手強いけど、<hex:02100103>何度でもくじけずに挑めば、きっと討伐できるよ。"
186,"TEXT_KINGYX901_05374_WANDERINGFELYNE_000_800","討伐依頼の達成、本当にありがとう！<hex:02100103>これで荒野の生態系が乱される心配もなくなったね。"
187,"TEXT_KINGYX901_05374_Q4_000_000","何と言う？"
188,"TEXT_KINGYX901_05374_A4_000_001","キミが討伐依頼を出してくれたおかげだ"
189,"TEXT_KINGYX901_05374_A4_000_002","それはそうと、キミは帰れるのか？"
190,"TEXT_KINGYX901_05374_WANDERINGFELYNE_000_802","そのやり方に慣れてたから。<hex:02100103>こっちにもモブハント組合っていうのがあって助かったなぁ。"
191,"TEXT_KINGYX901_05374_WANDERINGFELYNE_000_803","ボクらの土地じゃ、依頼を出すと、<hex:02100103>すごい早さでハンターさんたちが集まってくるんだよ。<hex:02100103>おかげでクエストカウンターはいつも大盛況！"
192,"TEXT_KINGYX901_05374_WANDERINGFELYNE_000_804","あ、そうだ。<hex:02100103>そろそろ禁足地に帰る方法を探さないと。"
193,"TEXT_KINGYX901_05374_WANDERINGFELYNE_000_805","わあ、そうだった！<hex:02100103>心配してくれてありがとう。"
194,"TEXT_KINGYX901_05374_WANDERINGFELYNE_000_806","次は禁足地に帰る方法を探さないとね。<hex:02100103>でも、それについては、そんなに焦っていないんだ。"
195,"TEXT_KINGYX901_05374_WANDERINGFELYNE_000_807","（★未使用／削除予定★）"
196,"TEXT_KINGYX901_05374_WANDERINGFELYNE_000_808","せっかくこんなに広大で、未知の世界に来たんだから、<hex:02100103>いろんな土地を見てまわって、帰る方法を探してみるよ！"
197,"TEXT_KINGYX901_05374_WANDERINGFELYNE_000_809","よそでは出会えない草花や鉱石、生き物たち、<hex:02100103>もちろん凶暴なモンスターも。<hex:02100103>旅の途中で見つけたものは、ぜんぶ図鑑に登録するんだ。"
198,"TEXT_KINGYX901_05374_WANDERINGFELYNE_000_810","帰る頃にはギッシリ埋まってるかも。<hex:02100103>そうしたら、ボクも立派な冒険者になれるかな？"
199,"TEXT_KINGYX901_05374_WANDERINGFELYNE_000_813","討伐が無事に完了したことを、<hex:02100103>トライヨラにいる、モブハント組合の人に報せにいこう。"
200,"TEXT_KINGYX901_05374_SYSTEM_000_814","セクレトは穏やかに佇んでいる。<hex:02100103>周囲の環境を興味深く眺めているようだ。"
201,"TEXT_KINGYX901_05374_SMITHERY05374_000_815","モンスターの素材をお持ちなら、うちで加工しますよ。<hex:02100103>珍しいものなら、そのまま別の品とも交換させていただきます。"
202,"TEXT_KINGYX901_05374_HUNTER05374_000_900","おお、例の魔獣を討伐したんですね！<hex:02100103>ありがとうございます、これで荒野に暮らす動物たちも、<hex:02100103>いつもどおりの暮らしに戻れることでしょう。"
203,"TEXT_KINGYX901_05374_WANDERINGFELYNE_000_901","ねぇ、アルシュベルドから剥ぎ取った「<hex:02280BFF05>Item<hex:F2B7FC0103>」を、<hex:02100103>引き取ってもらえないかな？<hex:02100103>ボクも拾ったんだけど、そのままにしておくのはもったいなくて。"
204,"TEXT_KINGYX901_05374_HUNTER05374_000_902","これは珍しい……！<hex:02100103>隣の加工屋なら、装備品の類に加工できますし、<hex:02100103>それ以外に様々な品物との交換もしてくれますよ。"
205,"TEXT_KINGYX901_05374_HUNTER05374_000_903","もし、ほかにも手に入るようでしたら、<hex:02100103>ぜひ持ち込んでみてください。"
206,"TEXT_KINGYX901_05374_WANDERINGFELYNE_000_904","あれっ、あっちで餌を食べてたのに。<hex:02100103>どうかしたの？"
207,"TEXT_KINGYX901_05374_WANDERINGFELYNE_000_905","あれれ、これは…。<hex:02100103>すっかり君に懐いたようだね。"
208,"TEXT_KINGYX901_05374_WANDERINGFELYNE_100_905","これからも君と一緒に旅をしたいみたい。<hex:02100103>よかったら、どうかな？"
209,"TEXT_KINGYX901_05374_WANDERINGFELYNE_200_905","うわぁ、よかったね！"
210,"TEXT_KINGYX901_05374_WANDERINGFELYNE_000_906","あらためて、いろいろと本当にありがとう！<hex:02100103>それじゃ、ボクはこの世界を見てまわる冒険に出発だ！"
211,"TEXT_KINGYX901_05374_WANDERINGFELYNE_100_906","また、いつか君に会えるのを楽しみにしているね！"
212,"TEXT_KINGYX901_05374_SYSTEM_000_907","トライヨラの鸞翔の城郭にいる異邦の詩人から、<hex:02100103>「極護竜アルシュベルド狩猟戦」を開放することができます。<hex:02100103>より多くの報酬を得られるため、ぜひ挑戦してみましょう！"
