key,0,1
166,"TEXT_AKTKSA502_04813_VARSARUDH_000_354","実は私も、どういった形で手を入れていただこうか、<hex:02100103>ずっと考えていたんですが……<hex:02100103>メジナから新商品の話を聞いて、閃きました！"
167,"TEXT_AKTKSA502_04813_VARSARUDH_000_355","これから私たちが作るのは、<hex:02100103>人々の信仰を大切にする品物。"
168,"TEXT_AKTKSA502_04813_VARSARUDH_000_356","そこで、タタルさんの出身国であるウルダハの守護神、<hex:02100103>商神ナルザルの印を刻んでみるのはどうでしょうか？<hex:02100103>もちろん宝石ではなく台座の方に、ですけど。"
169,"TEXT_AKTKSA502_04813_Q3_000_000","何と言う？"
170,"TEXT_AKTKSA502_04813_A3_000_001","任せてほしい"
171,"TEXT_AKTKSA502_04813_A3_000_002","がんばる……！"
172,"TEXT_AKTKSA502_04813_SYSTEM_000_358","宝石の台座に、商神の印を刻んだ！"
173,"TEXT_AKTKSA502_04813_VARSARUDH_000_359","綺麗にできましたね！<hex:02100103>これで仕上げも完了です！"
174,"TEXT_AKTKSA502_04813_MEHDJINA_000_360","タタルさんから、こちらに顔を出すと連絡がありました。<hex:02100103>港までお迎えにいって、旅の報告がてら、<hex:02100103>ネックレスも渡しちゃいましょう！"
175,"TEXT_AKTKSA502_04813_TATARU_000_400","わざわざ、お出迎えありがとうございまっす！"
176,"TEXT_AKTKSA502_04813_TATARU_000_401","みなさんも、試供品配りおつかれさまでっしたね！<hex:02100103>パーラカの里の様子はいかがでっしたか？"
177,"TEXT_AKTKSA502_04813_TATARU_000_402","なるほど、守護者の里だから装備の需要はある。<hex:02100103>けれど、今後について考えるとほかにも解決すべき問題があり、<hex:02100103>別の商品の方が求められているはずだ、と。"
178,"TEXT_AKTKSA502_04813_MEHDJINA_000_403","そこで、なんですけど……<hex:02100103>大繁盛商店の新商品について、改めて提案させてください！"
179,"TEXT_AKTKSA502_04813_MEHDJINA_000_404","サベネアの神獣様たちへの信仰を想起させるような工芸品を、<hex:02100103>パーラカの里と協業して開発してみるのはどうでしょうか？"
180,"TEXT_AKTKSA502_04813_MEHDJINA_000_405","そういった品が流通すれば、サベネア島を離れて暮らす人々も、<hex:02100103>日々の暮らしの中で己の在り方に迷わずに済むと思うんです！"
181,"TEXT_AKTKSA502_04813_HASDAHD_000_406","どうか、俺たちにやらせてください！"
182,"TEXT_AKTKSA502_04813_VARSARUDH_000_407","お願いします！"
183,"TEXT_AKTKSA502_04813_MEHDJINA_000_408","（★未使用／削除予定★）"
184,"TEXT_AKTKSA502_04813_TATARU_000_409","サベネア島から、世界へ……。<hex:02100103>なんとも大繁盛商店らしい新商品ではないでっすか！"
185,"TEXT_AKTKSA502_04813_TATARU_000_410","そうやって、ひとりひとりの顧客の想いに寄り添ってこそ、<hex:02100103>絆が育まれていくのでっす！<hex:02100103><hex:022C0DFF07><hex:022903EB0203><hex:FF02> <hex:0203>さんが示してくれたように！"
186,"TEXT_AKTKSA502_04813_TATARU_000_411","どのみち、試供品配りはそろそろ終了するつもりでっした。<hex:02100103>それよりも、うちの新商品を作る気満々ということは……？"
187,"TEXT_AKTKSA502_04813_HASDAHD_000_412","いろいろ考えたんですけど……<hex:02100103>里を離れた俺たちだからこそ、やれることがあると思うんです。"
188,"TEXT_AKTKSA502_04813_HASDAHD_000_413","だから、もうしばらくの間、<hex:02100103>大繁盛商店で働かせてください！"
189,"TEXT_AKTKSA502_04813_TATARU_000_414","こちらこそ、よろしくお願いしまっす！"
190,"TEXT_AKTKSA502_04813_VARSARUDH_000_415","タタルさん。<hex:02100103>実は、日ごろの感謝の代わりに、<hex:02100103>私たちみんなから贈り物がありまして……。"
191,"TEXT_AKTKSA502_04813_TATARU_000_416","なんと、そんなお気遣いいただけるなんて……！<hex:02100103>ありがたく、頂戴いたしまっす！"
192,"TEXT_AKTKSA502_04813_TATARU_000_417","……むむむ？<hex:02100103>このネックレスに使われている、<hex:02100103>涙型のサファイア、どこかで見覚えが……"
193,"TEXT_AKTKSA502_04813_TATARU_000_418","……<hex:022C0DFF07><hex:022903EB0203><hex:FF02> <hex:0203>さん。<hex:02100103>これは、もしかして私の母の……？"
194,"TEXT_AKTKSA502_04813_Q1_000_000","何と言う？"
195,"TEXT_AKTKSA502_04813_A1_000_001","タタルのところに返ってきたんだ"
196,"TEXT_AKTKSA502_04813_A1_000_002","気に入らなかった？"
197,"TEXT_AKTKSA502_04813_A1_000_003","裏には商神の印を入れてみた"
198,"TEXT_AKTKSA502_04813_TATARU_000_420","ということは……<hex:02100103>やはり、この宝石は母のものなのでっすね！"
199,"TEXT_AKTKSA502_04813_TATARU_000_421","と、とんでもないでっす！<hex:02100103>母のサファイアを、こんなに美しく輝かせてくれて、<hex:02100103>気に入らないわけがないのでっす……！"
200,"TEXT_AKTKSA502_04813_TATARU_000_422","それは縁起が良い！<hex:02100103>では、やはりこの宝石は母のものなのでっすね……！"
201,"TEXT_AKTKSA502_04813_TATARU_000_423","ああ、まさか再会できる日がくるなんて……。"
202,"TEXT_AKTKSA502_04813_TATARU_000_424","このサファイアのネックレスは、<hex:02100103>母が結婚したときに、祖母から譲られたものでっして……"
203,"TEXT_AKTKSA502_04813_TATARU_000_425","私が結婚する日がきたら、受け継いでほしいって、<hex:02100103>ほほえみながら話してくれた母の姿を、よく覚えていまっす。"
204,"TEXT_AKTKSA502_04813_TATARU_000_426","でも、あるとき、父の事業が失敗して、<hex:02100103>借金のカタに家財すべてを持ち去られて……。<hex:02100103>ネックレスも、それっきりでっした。"
205,"TEXT_AKTKSA502_04813_VARSARUDH_000_427","残念ながら、サファイア以外は失われてしまっていたそうです。<hex:02100103>それで、試供品配りで出会った方々の協力を得て、<hex:02100103>こういう形で修復させてもらいました。"
206,"TEXT_AKTKSA502_04813_TATARU_000_428","各地のみなさんが……？<hex:02100103>なるほど、いつも<hex:022C0DFF07><hex:022903EB0203><hex:FF02> <hex:0203>さんから、<hex:02100103>何かを受け取っていたのは、そういうことでっしたか。"
207,"TEXT_AKTKSA502_04813_TATARU_000_429","思えば、今の私があるのは、<hex:02100103>多くの出会いに恵まれたおかげ。"
208,"TEXT_AKTKSA502_04813_TATARU_000_430","その始まりは、ミンフィリアさん。<hex:02100103>家計を支えるために奉公していた宝石商に、<hex:02100103>採掘師時代の彼女が、原石を売りに来ていたのでっす。"
209,"TEXT_AKTKSA502_04813_TATARU_000_431","彼女の誘いを受けて、<hex:02100103>十二跡調査会の活動を手伝うようになってからは、<hex:02100103>目まぐるしい日々の連続でっした……！"
210,"TEXT_AKTKSA502_04813_TATARU_000_432","いろいろなことがありまっしたが、素敵なみなさんに出会えて、<hex:02100103>しかも、ネックレスまで戻ってくるなんて……！"
211,"TEXT_AKTKSA502_04813_TATARU_000_433","<hex:022C0DFF07><hex:022903EB0203><hex:FF02> <hex:0203>さんたちが、<hex:02100103>各地で想いを「輪」のように繋いでくださったおかげでっす！<hex:02100103>本当に……本当にありがとうございまっした！"
212,"TEXT_AKTKSA502_04813_HASDAHD_000_434","生とはただ美しきものにあらず。<hex:02100103>……だけど、美しい瞬間がたしかにあるんだ。"
213,"TEXT_AKTKSA502_04813_HASDAHD_000_435","これからも楽しい日々ばかりじゃないかもしれない。<hex:02100103>でもなんとかなるさ、タタルさんもいるんだし。"
214,"TEXT_AKTKSA502_04813_MEHDJINA_000_436","うん、そうだね……！"
215,"TEXT_AKTKSA502_04813_VARSARUDH_000_437","それじゃ、いつまでも留守にしてられないし、<hex:02100103>みんなで大繁盛商店に戻りましょう！"
216,"TEXT_AKTKSA502_04813_TATARU_000_438","よーし、それではさっそく、<hex:02100103>新たな販売計画を始動させていきまっすよー！"
217,"TEXT_AKTKSA502_04813_HASDAHD_000_550","この店を盛り上げることで、里の未来を明るいものに……<hex:02100103>大変そうだけど、やりがいのある目標ができました。<hex:02100103>いろいろとありがとうございます！"
218,"TEXT_AKTKSA502_04813_MEHDJINA_000_600","<hex:022C0DFF07><hex:022903EB0203><hex:FF02> <hex:0203>さん！<hex:02100103>今回の件も含めて、各国への試供品配り、<hex:02100103>本当にありがとうございました。"
219,"TEXT_AKTKSA502_04813_MEHDJINA_000_601","あたしたちから、是非ともお礼をしたいところなんですが……。"
220,"TEXT_AKTKSA502_04813_TATARU_000_602","フッフッフ……！<hex:02100103>それについては、ぬかりなく準備してあるのでっす！"
221,"TEXT_AKTKSA502_04813_TATARU_000_603","きっと<hex:022C0DFF07><hex:022903EB0203><hex:FF02> <hex:0203>さんは、<hex:02100103>これからも世界中を巡っていくはず。"
222,"TEXT_AKTKSA502_04813_TATARU_000_604","安全に旅を続け、まだ見ぬ土地で新たに出会う人々と、<hex:02100103>絆を結んでいってほしいという願いを込めて……。"
223,"TEXT_AKTKSA502_04813_TATARU_000_605","新しいチョコボ装甲を！<hex:02100103>このタタル、密かに手作りしておりまっした！"
224,"TEXT_AKTKSA502_04813_TATARU_000_606","さて、世界中から装備の注文が舞い込んできているうえに、<hex:02100103>パーラカの里と組んでの新商品開発……<hex:02100103>忙しくなることは必至でっす。"
225,"TEXT_AKTKSA502_04813_TATARU_000_607","しかし、メジナさん、ヴァルサルードさん、ハズダーダさん……<hex:02100103>ひとりひとりが、この店が掲げる理念に共感し、<hex:02100103>たくましく成長してくれた今、憂いはありません！"
226,"TEXT_AKTKSA502_04813_TATARU_000_608","だから、タタルの大繁盛商店は、<hex:02100103>これからも末永くやっていけると思いまっす！"
227,"TEXT_AKTKSA502_04813_TATARU_000_609","と、威勢のいい啖呵を切ってはみまっしたが、<hex:02100103>それでももし、また何かあったら……"
228,"TEXT_AKTKSA502_04813_TATARU_000_610","<hex:022C0DFF07><hex:022903EB0203><hex:FF02> <hex:0203>さん！<hex:02100103>そのときは、よろしくお願いしまっす！"
